{
  "$schema": "https://json-schema.org/draft/2020-12/schema",
  "title": "Tamil Setu Curriculum",
  "type": "array",
  "items": {
    "type": "object",
    "required": ["level", "topic", "description", "items"],
    "properties": {
      "level": { "type": "integer", "minimum": 1 },
      "topic": { "type": "string", "minLength": 1 },
      "description": { "type": "string", "minLength": 1 },
      "items": {
        "type": "array",
        "minItems": 1,
        "items": {
          "type": "object",
          "required": ["hindi", "formal", "spoken", "id"],
          "properties": {
            "hindi": { "type": "string", "minLength": 1 },
            "formal": { "type": "string", "minLength": 1 },
            "spoken": { "type": "string", "minLength": 1 },
            "id": { "type": "string", "minLength": 1 }
          },
          "additionalProperties": false
        }
      }
    },
    "additionalProperties": false
  }
}
