[
  {
    "level": 1,
    "topic": "Survival Basics",
    "description": "Instant words you need immediately.",
    "items": [
      {
        "hindi": "नमस्ते / हेलो",
        "formal": "வணக்கம்",
        "spoken": "வணக்கம்",
        "id": "l1_hello"
      },
      {
        "hindi": "हाँ",
        "formal": "ஆம்",
        "spoken": "ஆமா",
        "id": "l1_yes"
      },
      {
        "hindi": "नहीं",
        "formal": "இல்லை",
        "spoken": "இல்ல",
        "id": "l1_no"
      },
      {
        "hindi": "ठीक है (Okay)",
        "formal": "சரி",
        "spoken": "சரி",
        "id": "l1_okay"
      },
      {
        "hindi": "मुझे नहीं पता",
        "formal": "எனக்குத் தெரியாது",
        "spoken": "எனக்குத் தெரியாது",
        "id": "l1_dont_know"
      },
      {
        "hindi": "कोई बात नहीं",
        "formal": "பரவாயில்லை",
        "spoken": "பரவாயில்ல",
        "id": "l1_no_problem"
      },
      {
        "hindi": "जल्दी",
        "formal": "சீக்கிரம்",
        "spoken": "சீக்கிரம்",
        "id": "l1_fast"
      },
      {
        "hindi": "धीरे",
        "formal": "மெதுவாக",
        "spoken": "மெதுவா",
        "id": "l1_slow"
      },
      {
        "hindi": "रुको",
        "formal": "நில்லுங்கள்",
        "spoken": "நில்லுங்க",
        "id": "l1_stop"
      },
      {
        "hindi": "चलो / चलें",
        "formal": "போகலாம்",
        "spoken": "போலாம்",
        "id": "l1_lets_go"
      }
    ]
  },
  {
    "level": 2,
    "topic": "Pronouns (Street Style)",
    "description": "Note: In spoken Tamil, 'Hum' has two words (Namma vs Naanga).",
    "items": [
      {
        "hindi": "मैं",
        "formal": "நான்",
        "spoken": "நான்",
        "id": "l2_i"
      },
      {
        "hindi": "तुम (Casual)",
        "formal": "நீ",
        "spoken": "நீ",
        "id": "l2_you_casual"
      },
      {
        "hindi": "आप (Respect)",
        "formal": "நீங்கள்",
        "spoken": "நீங்க",
        "id": "l2_you_respect"
      },
      {
        "hindi": "हम (सब साथ में)",
        "formal": "நாம்",
        "spoken": "நம்ம",
        "id": "l2_we_inclusive"
      },
      {
        "hindi": "हम (सामने वाले को छोड़कर)",
        "formal": "நாங்கள்",
        "spoken": "நாங்க",
        "id": "l2_we_exclusive"
      },
      {
        "hindi": "यह (This person/thing)",
        "formal": "இவன்/இது",
        "spoken": "இவன் / இது",
        "id": "l2_this"
      },
      {
        "hindi": "वह (That person/thing)",
        "formal": "அவன்/அது",
        "spoken": "அவன் / அது",
        "id": "l2_that"
      }
    ]
  },
  {
    "level": 3,
    "topic": "Important Verbs (Command)",
    "description": "Short commands are the most common spoken form.",
    "items": [
      {
        "hindi": "आओ (Come)",
        "formal": "வாருங்கள்",
        "spoken": "வாங்க",
        "id": "l3_come"
      },
      {
        "hindi": "जाओ (Go)",
        "formal": "போங்கள்",
        "spoken": "போங்க",
        "id": "l3_go"
      },
      {
        "hindi": "खाओ (Eat)",
        "formal": "சாப்பிடுங்கள்",
        "spoken": "சாப்பிடுங்க",
        "id": "l3_eat"
      },
      {
        "hindi": "पीओ (Drink)",
        "formal": "குடியுங்கள்",
        "spoken": "குடிங்க",
        "id": "l3_drink"
      },
      {
        "hindi": "देखो (Look)",
        "formal": "பாருங்கள்",
        "spoken": "பாருங்க",
        "id": "l3_look"
      },
      {
        "hindi": "बैठो (Sit)",
        "formal": "உட்காருங்கள்",
        "spoken": "உக்காருங்க",
        "id": "l3_sit"
      },
      {
        "hindi": "सो जाओ (Sleep)",
        "formal": "தூங்குங்கள்",
        "spoken": "தூங்குங்க",
        "id": "l3_sleep"
      },
      {
        "hindi": "दो (Give)",
        "formal": "கொடுங்கள்",
        "spoken": "குடுங்க",
        "id": "l3_give"
      }
    ]
  },
  {
    "level": 4,
    "topic": "Common Questions",
    "description": "Adding 'aa' at the end of a word often makes it a question.",
    "items": [
      {
        "hindi": "क्या?",
        "formal": "என்ன?",
        "spoken": "என்ன?",
        "id": "l4_what"
      },
      {
        "hindi": "कहाँ?",
        "formal": "எங்கே?",
        "spoken": "எங்க?",
        "id": "l4_where"
      },
      {
        "hindi": "कब?",
        "formal": "எப்போது?",
        "spoken": "எப்போ?",
        "id": "l4_when"
      },
      {
        "hindi": "क्यों?",
        "formal": "ஏன்?",
        "spoken": "ஏன்?",
        "id": "l4_why"
      },
      {
        "hindi": "कौन?",
        "formal": "யார்?",
        "spoken": "யாரு?",
        "id": "l4_who"
      },
      {
        "hindi": "कितना? (Money)",
        "formal": "எவ்வளவு?",
        "spoken": "எவ்ளோ?",
        "id": "l4_how_much"
      },
      {
        "hindi": "कैसे?",
        "formal": "எப்படி?",
        "spoken": "எப்டி?",
        "id": "l4_how"
      },
      {
        "hindi": "खाना खाया? (Ate?)",
        "formal": "சாப்பிட்டீர்களா?",
        "spoken": "சாப்டாச்சா?",
        "id": "l4_ate"
      }
    ]
  },
  {
    "level": 5,
    "topic": "Connecting Words",
    "description": "These glue sentences together.",
    "items": [
      {
        "hindi": "यहाँ",
        "formal": "இங்கே",
        "spoken": "இங்க",
        "id": "l5_here"
      },
      {
        "hindi": "वहाँ",
        "formal": "அங்கே",
        "spoken": "அங்க",
        "id": "l5_there"
      },
      {
        "hindi": "अभी",
        "formal": "இப்போது",
        "spoken": "இப்போ",
        "id": "l5_now"
      },
      {
        "hindi": "बाद में",
        "formal": "பிறகு",
        "spoken": "அப்புறம்",
        "id": "l5_later"
      },
      {
        "hindi": "लेकिन",
        "formal": "ஆனால்",
        "spoken": "ஆனா",
        "id": "l5_but"
      },
      {
        "hindi": "और",
        "formal": "மற்றும்",
        "spoken": "அப்புறம் / இன்னும்",
        "id": "l5_and"
      }
    ]
  },
  {
    "level": 6,
    "topic": "The Magic '-ku' (To/For)",
    "description": "Add '-ku' to any place or person to mean 'To' or 'For'.",
    "items": [
      {
        "hindi": "मुझे (To me)",
        "formal": "எனக்கு",
        "spoken": "எனக்கு",
        "id": "l6_to_me"
      },
      {
        "hindi": "तुम्हें (To you)",
        "formal": "உனக்கு",
        "spoken": "உனக்கு",
        "id": "l6_to_you_casual"
      },
      {
        "hindi": "आपको (To you - Respect)",
        "formal": "உங்களுக்கு",
        "spoken": "உங்களுக்கு",
        "id": "l6_to_you_respect"
      },
      {
        "hindi": "घर को / घर जाना है",
        "formal": "வீட்டிற்கு",
        "spoken": "வீட்டுக்கு",
        "id": "l6_to_house"
      },
      {
        "hindi": "ऑफिस को",
        "formal": "அலுவலகத்திற்கு",
        "spoken": "ஆபீஸூக்கு",
        "id": "l6_to_office"
      },
      {
        "hindi": "दुकान को",
        "formal": "கடைக்கு",
        "spoken": "கடைக்கு",
        "id": "l6_to_shop"
      },
      {
        "hindi": "बैंगलोर को",
        "formal": "பெங்களூருக்கு",
        "spoken": "பெங்களூருக்கு",
        "id": "l6_to_bangalore"
      }
    ]
  },
  {
    "level": 7,
    "topic": "The Magic '-la' (In/At/By)",
    "description": "Add '-la' to say something is INSIDE or AT a place.",
    "items": [
      {
        "hindi": "घर में (In the house)",
        "formal": "வீட்டில்",
        "spoken": "வீட்ல",
        "id": "l7_in_house"
      },
      {
        "hindi": "रास्ते में (On the way)",
        "formal": "வழியில்",
        "spoken": "வழியில",
        "id": "l7_on_way"
      },
      {
        "hindi": "हाथ में",
        "formal": "கையில்",
        "spoken": "கைல",
        "id": "l7_in_hand"
      },
      {
        "hindi": "गाड़ी में (In the car/bike)",
        "formal": "வண்டியில்",
        "spoken": "வண்டில",
        "id": "l7_in_vehicle"
      },
      {
        "hindi": "बैंगलोर में",
        "formal": "பெங்களூரில்",
        "spoken": "பெங்களூர்ல",
        "id": "l7_in_bangalore"
      },
      {
        "hindi": "हिंदी में",
        "formal": "இந்தியில்",
        "spoken": "ஹிந்தில",
        "id": "l7_in_hindi"
      }
    ]
  },
  {
    "level": 8,
    "topic": "Past Tense (Finished Action)",
    "description": "Used for 80% of daily updates.",
    "items": [
      {
        "hindi": "मैं गया (I went)",
        "formal": "நான் சென்றேன்",
        "spoken": "நான் போனேன்",
        "id": "l8_i_went"
      },
      {
        "hindi": "मैं आया (I came)",
        "formal": "நான் வந்தேன்",
        "spoken": "நான் வந்தேன்",
        "id": "l8_i_came"
      },
      {
        "hindi": "मैंने देखा (I saw)",
        "formal": "நான் பார்த்தேன்",
        "spoken": "நான் பாத்தேன்",
        "id": "l8_i_saw"
      },
      {
        "hindi": "मैंने ख़रीदा (I bought)",
        "formal": "நான் வாங்கினேன்",
        "spoken": "நான் வாங்கினேன்",
        "id": "l8_i_bought"
      },
      {
        "hindi": "उसने दिया (He/She gave)",
        "formal": "அவர் கொடுத்தார்",
        "spoken": "அவரு குடுத்தாரு",
        "id": "l8_he_gave"
      },
      {
        "hindi": "खत्म हो गया (Finished)",
        "formal": "முடிந்தது",
        "spoken": "முடிஞ்சுது",
        "id": "l8_finished"
      }
    ]
  },
  {
    "level": 9,
    "topic": "Present Continuous (Right Now)",
    "description": "What are you doing currently?",
    "items": [
      {
        "hindi": "मैं जा रहा हूँ",
        "formal": "நான் செல்கிறேன்",
        "spoken": "நான் போறேன்",
        "id": "l9_im_going"
      },
      {
        "hindi": "मैं आ रहा हूँ",
        "formal": "நான் வருகிறேன்",
        "spoken": "நான் வர்றேன்",
        "id": "l9_im_coming"
      },
      {
        "hindi": "बारिश हो रही है",
        "formal": "மழை பெய்கிறது",
        "spoken": "மழை பெய்யுது",
        "id": "l9_raining"
      },
      {
        "hindi": "समझ आ रहा है?",
        "formal": "புரிகிறதா?",
        "spoken": "புரியுதா?",
        "id": "l9_understanding"
      },
      {
        "hindi": "भूख लग रही है",
        "formal": "பசிக்கிறது",
        "spoken": "பசிக்குது",
        "id": "l9_hungry"
      },
      {
        "hindi": "क्या कर रहे हो?",